------[ Versions ]------

Program Version : EVEREST v4.60.1629 Beta
BenchDLL Version: 2.4.257.0

------[ CPU Info ]------

CPU Type           : AMD Athlon, 750 MHz (7.5 x 100)
CPU Alias          : Pluto, K75
CPU Platform       : Slot A
CPU Stepping       : A2
Instruction Set    : x86, MMX, 3DNow!
CPUID Manufacturer : AuthenticAMD
CPUID CPU Name     : AMD Athlon(tm) Processor
CPUID Revision     : 00000622h
Platform ID        : CFh  (Slot A)

------[ Logical CPU #0 ]------

allcpu: Valid

CPUID 00000000: 00000001-68747541-444D4163-69746E65
CPUID 00000001: 00000622-00000000-00000000-0183F9FF
CPUID 80000000: 80000006-68747541-444D4163-69746E65
CPUID 80000001: 00000722-00000000-00000000-C1C3F9FF
CPUID 80000002: 20444D41-6C687441-74286E6F-5020296D
CPUID 80000003: 65636F72-726F7373-00000000-00000000
CPUID 80000004: 00000000-00000000-00000000-00000000
CPUID 80000005: 0408FF08-FF18FF10-40020140-40020140
CPUID 80000006: 00000000-41004100-02002140-00000000

------[ MSR Registers ]------

MSR 0000001B: 0000-0000-FEE0-0100
MSR C0010015: 0000-0000-0970-1008
