------[ Versions ]------

Program Version : EVEREST v4.60.1629 Beta
BenchDLL Version: 2.4.257.0

------[ CPU Info ]------

CPU Type           : AMD Athlon XP, 1800 MHz (13.5 x 133) 2200+
CPU Alias          : Thoroughbred-A
CPU Platform       : Socket A
CPU Stepping       : A0
Instruction Set    : x86, MMX, 3DNow!, SSE
CPUID Manufacturer : AuthenticAMD
CPUID CPU Name     : AMD Athlon(tm) XP 2200+
CPUID Revision     : 00000680h
Platform ID        : D1h  (Socket A)

------[ Logical CPU #0 ]------

allcpu: Valid

CPUID 00000000: 00000001-68747541-444D4163-69746E65
CPUID 00000001: 00000680-00000000-00000000-0383FBFF
CPUID 80000000: 80000008-68747541-444D4163-69746E65
CPUID 80000001: 00000780-00000000-00000000-C1C3FBFF
CPUID 80000002: 20444D41-6C687441-74286E6F-5820296D
CPUID 80000003: 32322050-002B3030-00000000-00000000
CPUID 80000004: 00000000-00000000-00000000-00000000
CPUID 80000005: 0408FF08-FF20FF10-40020140-40020140
CPUID 80000006: 00000000-41004100-01008140-00000000
CPUID 80000007: 00000000-00000000-00000000-00000001
CPUID 80000008: 00002022-00000000-00000000-00000000

------[ MSR Registers ]------

MSR 0000001B: 0000-0000-FEE0-0900
MSR C0010015: 0000-0000-050B-1008
